{
 "schema_version": "1.0",
 "benchmark": {
  "name": "SOTIF perception benchmark (KITTI camera track)",
  "spec_version": "1",
  "spec_sha256": "ecca51391760f9ee9b598ee9155942cc385333f56369f2b47c29552878e7f98e"
 },
 "submission": {
  "model": "torchvision:ssdlite320_mobilenet_v3_large",
  "weights": "SSDLite320_MobileNet_V3_Large_Weights.COCO_V1 (COCO)",
  "framework": "torch 2.15.0+cpu, torchvision 0.29.2+cpu",
  "training_data": "COCO 2017 train (no KITTI)",
  "name": "ssdlite320_mobilenet_v3_large",
  "score_threshold": 0.5,
  "date": "2026-10-29",
  "avsafety_version": "1.1.0"
 },
 "run": {
  "runtime_s": 371.1,
  "n_frames": 120,
  "conditions": [
   "clear",
   "fog_200",
   "fog_100",
   "fog_50",
   "fog_25",
   "low_light_64",
   "low_light_256",
   "lens_dirt_25"
  ],
  "official": true,
  "hardware": "x86_64, Linux, Python 3.13.17"
 },
 "requirement": {
  "id": "PR-01",
  "cls": "pedestrian",
  "min_recall": 0.9,
  "confidence": 0.95,
  "method": "clopper-pearson",
  "max_speed_kmh": 60.0,
  "reaction_s": 0.6,
  "decel_mps2": 6.0,
  "lateral_m": 4.0,
  "min_height_px": 25.0,
  "max_occlusion": 1,
  "max_truncation": null,
  "speeds_kmh": [
   10,
   15,
   20,
   25,
   30,
   35,
   40,
   45,
   50,
   55,
   60
  ],
  "odd_conditions": [
   "clear",
   "low_light_64"
  ],
  "max_fp_per_frame": null,
  "source": "08-05 capstone PR-01: per-frame pedestrian recall >= 0.90 with 95 % one-sided confidence within the stopping distance at 60 km/h (0.6 s, 6 m/s^2), |lateral| <= 4 m, occlusion <= 1, height >= 25 px",
  "range_m": 33.15
 },
 "metrics": {
  "by_condition": [
   {
    "condition": "clear",
    "class": "pedestrian",
    "n": 520,
    "detected": 9,
    "recall": 0.0173,
    "ci_low": 0.0079,
    "ci_high": 0.0326,
    "fp": 1,
    "fp_per_frame": 0.0083,
    "fp_per_frame_ci": [
     0.0002,
     0.0464
    ]
   },
   {
    "condition": "clear",
    "class": "cyclist",
    "n": 70,
    "detected": 1,
    "recall": 0.0143,
    "ci_low": 0.0004,
    "ci_high": 0.077,
    "fp": 1,
    "fp_per_frame": 0.0083,
    "fp_per_frame_ci": [
     0.0002,
     0.0464
    ]
   },
   {
    "condition": "clear",
    "class": "car",
    "n": 213,
    "detected": 54,
    "recall": 0.2535,
    "ci_low": 0.1966,
    "ci_high": 0.3175,
    "fp": 2,
    "fp_per_frame": 0.0167,
    "fp_per_frame_ci": [
     0.002,
     0.0602
    ]
   },
   {
    "condition": "fog_200",
    "class": "pedestrian",
    "n": 520,
    "detected": 20,
    "recall": 0.0385,
    "ci_low": 0.0236,
    "ci_high": 0.0588,
    "fp": 6,
    "fp_per_frame": 0.05,
    "fp_per_frame_ci": [
     0.0183,
     0.1088
    ]
   },
   {
    "condition": "fog_200",
    "class": "cyclist",
    "n": 70,
    "detected": 0,
    "recall": 0.0,
    "ci_low": 0.0,
    "ci_high": 0.0513,
    "fp": 1,
    "fp_per_frame": 0.0083,
    "fp_per_frame_ci": [
     0.0002,
     0.0464
    ]
   },
   {
    "condition": "fog_200",
    "class": "car",
    "n": 213,
    "detected": 28,
    "recall": 0.1315,
    "ci_low": 0.0892,
    "ci_high": 0.1844,
    "fp": 1,
    "fp_per_frame": 0.0083,
    "fp_per_frame_ci": [
     0.0002,
     0.0464
    ]
   },
   {
    "condition": "fog_100",
    "class": "pedestrian",
    "n": 520,
    "detected": 23,
    "recall": 0.0442,
    "ci_low": 0.0282,
    "ci_high": 0.0656,
    "fp": 7,
    "fp_per_frame": 0.0583,
    "fp_per_frame_ci": [
     0.0235,
     0.1202
    ]
   },
   {
    "condition": "fog_100",
    "class": "cyclist",
    "n": 70,
    "detected": 0,
    "recall": 0.0,
    "ci_low": 0.0,
    "ci_high": 0.0513,
    "fp": 0,
    "fp_per_frame": 0.0,
    "fp_per_frame_ci": [
     0.0,
     0.0307
    ]
   },
   {
    "condition": "fog_100",
    "class": "car",
    "n": 213,
    "detected": 19,
    "recall": 0.0892,
    "ci_low": 0.0546,
    "ci_high": 0.1358,
    "fp": 0,
    "fp_per_frame": 0.0,
    "fp_per_frame_ci": [
     0.0,
     0.0307
    ]
   },
   {
    "condition": "fog_50",
    "class": "pedestrian",
    "n": 520,
    "detected": 19,
    "recall": 0.0365,
    "ci_low": 0.0221,
    "ci_high": 0.0565,
    "fp": 10,
    "fp_per_frame": 0.0833,
    "fp_per_frame_ci": [
     0.04,
     0.1533
    ]
   },
   {
    "condition": "fog_50",
    "class": "cyclist",
    "n": 70,
    "detected": 0,
    "recall": 0.0,
    "ci_low": 0.0,
    "ci_high": 0.0513,
    "fp": 0,
    "fp_per_frame": 0.0,
    "fp_per_frame_ci": [
     0.0,
     0.0307
    ]
   },
   {
    "condition": "fog_50",
    "class": "car",
    "n": 213,
    "detected": 14,
    "recall": 0.0657,
    "ci_low": 0.0364,
    "ci_high": 0.1078,
    "fp": 0,
    "fp_per_frame": 0.0,
    "fp_per_frame_ci": [
     0.0,
     0.0307
    ]
   },
   {
    "condition": "fog_25",
    "class": "pedestrian",
    "n": 520,
    "detected": 15,
    "recall": 0.0288,
    "ci_low": 0.0162,
    "ci_high": 0.0471,
    "fp": 6,
    "fp_per_frame": 0.05,
    "fp_per_frame_ci": [
     0.0183,
     0.1088
    ]
   },
   {
    "condition": "fog_25",
    "class": "cyclist",
    "n": 70,
    "detected": 0,
    "recall": 0.0,
    "ci_low": 0.0,
    "ci_high": 0.0513,
    "fp": 0,
    "fp_per_frame": 0.0,
    "fp_per_frame_ci": [
     0.0,
     0.0307
    ]
   },
   {
    "condition": "fog_25",
    "class": "car",
    "n": 213,
    "detected": 5,
    "recall": 0.0235,
    "ci_low": 0.0077,
    "ci_high": 0.0539,
    "fp": 0,
    "fp_per_frame": 0.0,
    "fp_per_frame_ci": [
     0.0,
     0.0307
    ]
   },
   {
    "condition": "low_light_64",
    "class": "pedestrian",
    "n": 520,
    "detected": 3,
    "recall": 0.0058,
    "ci_low": 0.0012,
    "ci_high": 0.0168,
    "fp": 0,
    "fp_per_frame": 0.0,
    "fp_per_frame_ci": [
     0.0,
     0.0307
    ]
   },
   {
    "condition": "low_light_64",
    "class": "cyclist",
    "n": 70,
    "detected": 0,
    "recall": 0.0,
    "ci_low": 0.0,
    "ci_high": 0.0513,
    "fp": 0,
    "fp_per_frame": 0.0,
    "fp_per_frame_ci": [
     0.0,
     0.0307
    ]
   },
   {
    "condition": "low_light_64",
    "class": "car",
    "n": 213,
    "detected": 8,
    "recall": 0.0376,
    "ci_low": 0.0164,
    "ci_high": 0.0727,
    "fp": 0,
    "fp_per_frame": 0.0,
    "fp_per_frame_ci": [
     0.0,
     0.0307
    ]
   },
   {
    "condition": "low_light_256",
    "class": "pedestrian",
    "n": 520,
    "detected": 0,
    "recall": 0.0,
    "ci_low": 0.0,
    "ci_high": 0.0071,
    "fp": 0,
    "fp_per_frame": 0.0,
    "fp_per_frame_ci": [
     0.0,
     0.0307
    ]
   },
   {
    "condition": "low_light_256",
    "class": "cyclist",
    "n": 70,
    "detected": 0,
    "recall": 0.0,
    "ci_low": 0.0,
    "ci_high": 0.0513,
    "fp": 0,
    "fp_per_frame": 0.0,
    "fp_per_frame_ci": [
     0.0,
     0.0307
    ]
   },
   {
    "condition": "low_light_256",
    "class": "car",
    "n": 213,
    "detected": 1,
    "recall": 0.0047,
    "ci_low": 0.0001,
    "ci_high": 0.0259,
    "fp": 1,
    "fp_per_frame": 0.0083,
    "fp_per_frame_ci": [
     0.0002,
     0.0464
    ]
   },
   {
    "condition": "lens_dirt_25",
    "class": "pedestrian",
    "n": 520,
    "detected": 6,
    "recall": 0.0115,
    "ci_low": 0.0042,
    "ci_high": 0.0249,
    "fp": 4,
    "fp_per_frame": 0.0333,
    "fp_per_frame_ci": [
     0.0091,
     0.0853
    ]
   },
   {
    "condition": "lens_dirt_25",
    "class": "cyclist",
    "n": 70,
    "detected": 1,
    "recall": 0.0143,
    "ci_low": 0.0004,
    "ci_high": 0.077,
    "fp": 1,
    "fp_per_frame": 0.0083,
    "fp_per_frame_ci": [
     0.0002,
     0.0464
    ]
   },
   {
    "condition": "lens_dirt_25",
    "class": "car",
    "n": 213,
    "detected": 48,
    "recall": 0.2254,
    "ci_low": 0.1711,
    "ci_high": 0.2874,
    "fp": 2,
    "fp_per_frame": 0.0167,
    "fp_per_frame_ci": [
     0.002,
     0.0602
    ]
   }
  ],
  "by_distance": [
   {
    "condition": "clear",
    "class": "pedestrian",
    "band": "0-10 m",
    "n": 100,
    "detected": 7,
    "recall": 0.07,
    "ci_low": 0.0286,
    "ci_high": 0.1389
   },
   {
    "condition": "clear",
    "class": "pedestrian",
    "band": "10-20 m",
    "n": 227,
    "detected": 2,
    "recall": 0.0088,
    "ci_low": 0.0011,
    "ci_high": 0.0315
   },
   {
    "condition": "clear",
    "class": "pedestrian",
    "band": "20-30 m",
    "n": 138,
    "detected": 0,
    "recall": 0.0,
    "ci_low": 0.0,
    "ci_high": 0.0264
   },
   {
    "condition": "clear",
    "class": "pedestrian",
    "band": "30-40 m",
    "n": 47,
    "detected": 0,
    "recall": 0.0,
    "ci_low": 0.0,
    "ci_high": 0.0755
   },
   {
    "condition": "clear",
    "class": "pedestrian",
    "band": ">= 40 m",
    "n": 8,
    "detected": 0,
    "recall": 0.0,
    "ci_low": 0.0,
    "ci_high": 0.3694
   },
   {
    "condition": "clear",
    "class": "cyclist",
    "band": "0-10 m",
    "n": 16,
    "detected": 1,
    "recall": 0.0625,
    "ci_low": 0.0016,
    "ci_high": 0.3023
   },
   {
    "condition": "clear",
    "class": "cyclist",
    "band": "10-20 m",
    "n": 29,
    "detected": 0,
    "recall": 0.0,
    "ci_low": 0.0,
    "ci_high": 0.1194
   },
   {
    "condition": "clear",
    "class": "cyclist",
    "band": "20-30 m",
    "n": 17,
    "detected": 0,
    "recall": 0.0,
    "ci_low": 0.0,
    "ci_high": 0.1951
   },
   {
    "condition": "clear",
    "class": "cyclist",
    "band": "30-40 m",
    "n": 7,
    "detected": 0,
    "recall": 0.0,
    "ci_low": 0.0,
    "ci_high": 0.4096
   },
   {
    "condition": "clear",
    "class": "cyclist",
    "band": ">= 40 m",
    "n": 1,
    "detected": 0,
    "recall": 0.0,
    "ci_low": 0.0,
    "ci_high": 0.975
   },
   {
    "condition": "clear",
    "class": "car",
    "band": "0-10 m",
    "n": 22,
    "detected": 22,
    "recall": 1.0,
    "ci_low": 0.8456,
    "ci_high": 1.0
   },
   {
    "condition": "clear",
    "class": "car",
    "band": "10-20 m",
    "n": 73,
    "detected": 32,
    "recall": 0.4384,
    "ci_low": 0.3224,
    "ci_high": 0.5595
   },
   {
    "condition": "clear",
    "class": "car",
    "band": "20-30 m",